{
    "15-2-26_Stellar_Capacity": {
        "date": "15-2-26",
        "company": "Stellar Capacity",
        "folder_name": "Stellar_Capacity",
        "country": "Unknown",
        "status": "Unknown",
        "cv_found": true,
        "last_updated": "2026-02-15 10:08:37"
    },
    "10-2-26_Eir_Business_Talent": {
        "date": "10-2-26",
        "company": "Eir Business Talent",
        "country": "Unknown",
        "status": "Unknown",
        "last_updated": "2026-02-10 09:34:20",
        "cv_found": true,
        "folder_name": "Eir_Business_Talent"
    },
    "4-2-26_Hays": {
        "date": "04-02-26",
        "company": "Hays",
        "folder_name": "Hays",
        "country": "Ireland",
        "status": "Unknown",
        "cv_found": true,
        "last_updated": "2026-02-18 15:33:45",
        "country_manual": true
    },
    "6-2-26_atrium": {
        "date": "6-2-26",
        "company": "atrium",
        "country": "Unknown",
        "status": "Unknown",
        "last_updated": "2026-02-06 15:11:13",
        "cv_found": true,
        "folder_name": "atrium"
    },
    "17-2-26_Amazon": {
        "date": "17-2-26",
        "company": "Amazon",
        "country": "Spain",
        "status": "Unknown",
        "last_updated": "2026-02-17 13:58:13",
        "cv_found": true,
        "folder_name": "Amazon"
    },
    "16-2-26_Einride": {
        "date": "16-2-26",
        "company": "Einride",
        "country": "Sweden",
        "status": "Unknown",
        "last_updated": "2026-02-16 11:45:33",
        "cv_found": true,
        "folder_name": "Einride"
    },
    "12-2-26_Enode": {
        "date": "12-02-26",
        "company": "Enode",
        "folder_name": "Enode",
        "country": "Norway",
        "status": "Rejected",
        "cv_found": true,
        "last_updated": "2026-02-18 15:28:36",
        "country_manual": true
    },
    "12-2-26_Abbott": {
        "date": "12-2-26",
        "company": "Abbott",
        "country": "Unknown",
        "status": "Unknown",
        "last_updated": "2026-02-12 10:13:22",
        "cv_found": true,
        "folder_name": "Abbott"
    },
    "6-2-26_Hm": {
        "date": "06-02-26",
        "company": "Hm",
        "country": "Sweden",
        "status": "Rejected",
        "last_updated": "2026-02-18 15:33:14",
        "cv_found": true,
        "folder_name": "Hm",
        "country_manual": true
    },
    "6-2-26_testing_cover_letter": {
        "date": "6-2-26",
        "company": "testing cover letter",
        "country": "Unknown",
        "status": "Unknown",
        "last_updated": "2026-02-06 18:21:25",
        "cv_found": true,
        "folder_name": "testing_cover_letter"
    },
    "4-2-26_SoTalent": {
        "date": "04-02-26",
        "company": "SoTalent",
        "country": "Netherlands",
        "status": "Rejected",
        "last_updated": "2026-02-18 15:32:41",
        "cv_found": true,
        "folder_name": "SoTalent",
        "country_manual": true
    },
    "6-2-26_bestseller": {
        "date": "6-2-26",
        "company": "bestseller",
        "country": "Unknown",
        "status": "Unknown",
        "last_updated": "2026-02-06 12:30:45",
        "cv_found": true,
        "folder_name": "bestseller"
    },
    "4-2-26_SAMY": {
        "date": "4-2-26",
        "company": "SAMY",
        "country": "Unknown",
        "status": "Followed Up",
        "last_updated": "2026-02-04 14:29:34",
        "cv_found": true,
        "folder_name": "SAMY"
    },
    "13-2-26_Deutsche_B\u00f6rse_Group": {
        "date": "13-2-26",
        "company": "Deutsche B\u00f6rse Group",
        "country": "Ireland",
        "status": "Unknown",
        "last_updated": "2026-02-13 17:20:26",
        "cv_found": true,
        "folder_name": "Deutsche_B\u00f6rse_Group"
    },
    "11-2-26_Hays": {
        "date": "11-02-26",
        "company": "Hays",
        "country": "Ireland",
        "status": "Unknown",
        "last_updated": "2026-02-18 15:34:13",
        "cv_found": true,
        "folder_name": "Hays",
        "country_manual": true
    },
    "9-2-26_Leovegas_Group": {
        "date": "9-2-26",
        "company": "Leovegas Group",
        "country": "Sweden",
        "status": "Unknown",
        "last_updated": "2026-02-09 10:20:34",
        "cv_found": true,
        "folder_name": "Leovegas_Group"
    },
    "16-2-26_Sd_Worx": {
        "date": "16-2-26",
        "company": "Sd Worx",
        "country": "Spain",
        "status": "Rejected",
        "last_updated": "2026-02-16 09:20:35",
        "cv_found": true,
        "folder_name": "Sd_Worx"
    },
    "5-2-26_Pagen": {
        "date": "5-2-26",
        "company": "Pagen",
        "country": "Sweden",
        "status": "Unknown",
        "last_updated": "2026-02-05 10:18:41",
        "cv_found": true,
        "folder_name": "Pagen"
    },
    "10-2-26_Kognity": {
        "date": "10-2-26",
        "company": "Kognity",
        "country": "Unknown",
        "status": "Rejected",
        "last_updated": "2026-02-10 19:19:26",
        "cv_found": true,
        "folder_name": "Kognity"
    },
    "4-2-26_Imperial": {
        "date": "04-02-26",
        "company": "Imperial",
        "folder_name": "Imperial",
        "country": "UK",
        "status": "Unknown",
        "cv_found": true,
        "last_updated": "2026-02-18 15:32:46",
        "country_manual": true
    },
    "14-2-26_Star_Stable_Entertainment": {
        "date": "14-2-26",
        "company": "Star Stable Entertainment",
        "country": "Sweden",
        "status": "Unknown",
        "last_updated": "2026-02-14 15:45:52",
        "cv_found": true,
        "folder_name": "Star_Stable_Entertainment"
    },
    "17-2-26_Tetra_Pak": {
        "date": "17-2-26",
        "company": "Tetra Pak",
        "country": "Sweden",
        "status": "Unknown",
        "last_updated": "2026-02-17 09:23:52",
        "cv_found": true,
        "folder_name": "Tetra_Pak"
    },
    "10-2-26_Zalando": {
        "date": "10-2-26",
        "company": "Zalando",
        "country": "Unknown",
        "status": "Rejected",
        "last_updated": "2026-02-10 20:02:17",
        "cv_found": true,
        "folder_name": "Zalando"
    },
    "4-2-26_JDE_Peets": {
        "date": "04-02-26",
        "company": "JDE Peets",
        "folder_name": "JDE_Peets",
        "country": "Denmark",
        "status": "Unknown",
        "cv_found": true,
        "last_updated": "2026-02-18 15:32:32",
        "country_manual": true
    },
    "11-2-26_Xeneta": {
        "date": "11-2-26",
        "company": "Xeneta",
        "country": "Norway",
        "status": "Unknown",
        "last_updated": "2026-02-11 17:13:50",
        "cv_found": true,
        "folder_name": "Xeneta"
    },
    "10-2-26_Hm": {
        "date": "10-02-26",
        "company": "Hm",
        "country": "Sweden",
        "status": "Unknown",
        "last_updated": "2026-02-18 15:34:20",
        "cv_found": true,
        "folder_name": "Hm",
        "country_manual": true
    },
    "16-2-26_Publicis_Groupe": {
        "date": "16-2-26",
        "company": "Publicis Groupe",
        "country": "Sweden",
        "status": "Unknown",
        "last_updated": "2026-02-16 17:41:02",
        "cv_found": true,
        "folder_name": "Publicis_Groupe"
    },
    "10-2-26_Wolt": {
        "date": "10-2-26",
        "company": "Wolt",
        "country": "Unknown",
        "status": "Unknown",
        "last_updated": "2026-02-10 14:28:01",
        "cv_found": true,
        "folder_name": "Wolt"
    },
    "9-2-26_Quinyx": {
        "date": "9-2-26",
        "company": "Quinyx",
        "country": "Unknown",
        "status": "Unknown",
        "last_updated": "2026-02-09 11:14:49",
        "cv_found": true,
        "folder_name": "Quinyx"
    },
    "17-2-26_Tobii_Dynavox": {
        "date": "17-2-26",
        "company": "Tobii Dynavox",
        "country": "Sweden",
        "status": "Unknown",
        "last_updated": "2026-02-17 12:58:18",
        "cv_found": true,
        "folder_name": "Tobii_Dynavox"
    },
    "10-2-26_Solita": {
        "date": "10-02-26",
        "company": "Solita",
        "country": "Finland",
        "status": "Rejected",
        "last_updated": "2026-02-18 15:31:23",
        "cv_found": true,
        "folder_name": "Solita",
        "country_manual": true
    },
    "18-2-26_Citizenm": {
        "date": "18-2-26",
        "company": "Citizenm",
        "country": "Netherlands",
        "status": "Unknown",
        "cv_found": true,
        "last_updated": "2026-02-18 10:44:34",
        "folder_name": "Citizenm"
    },
    "6-2-26_smartly": {
        "date": "6-2-26",
        "company": "smartly",
        "country": "Unknown",
        "status": "Rejected",
        "last_updated": "2026-02-06 15:40:56",
        "cv_found": true,
        "folder_name": "smartly"
    },
    "7-2-26_Unity": {
        "date": "7-2-26",
        "company": "Unity",
        "country": "Unknown",
        "status": "Unknown",
        "last_updated": "2026-02-07 10:10:43",
        "cv_found": true,
        "folder_name": "Unity"
    },
    "17-2-26_Sandvik": {
        "date": "17-2-26",
        "company": "Sandvik",
        "country": "Ireland",
        "status": "Unknown",
        "last_updated": "2026-02-17 09:40:08",
        "cv_found": true,
        "folder_name": "Sandvik"
    },
    "5-2-26_city": {
        "date": "5-2-26",
        "company": "city",
        "country": "Unknown",
        "status": "Unknown",
        "last_updated": "2026-02-05 18:48:41",
        "cv_found": true,
        "folder_name": "city"
    },
    "9-2-26_Verisure": {
        "date": "9-2-26",
        "company": "Verisure",
        "country": "Unknown",
        "status": "Unknown",
        "last_updated": "2026-02-09 13:21:07",
        "cv_found": true,
        "folder_name": "Verisure"
    },
    "16-2-26_Webbeds": {
        "date": "16-2-26",
        "company": "Webbeds",
        "country": "Spain",
        "status": "Unknown",
        "last_updated": "2026-02-16 10:37:26",
        "cv_found": true,
        "folder_name": "Webbeds"
    },
    "16-2-26_Voltrac": {
        "date": "16-2-26",
        "company": "Voltrac",
        "country": "Spain",
        "status": "Unknown",
        "last_updated": "2026-02-16 09:45:04",
        "cv_found": true,
        "folder_name": "Voltrac"
    },
    "6-2-26_avaron": {
        "date": "06-02-26",
        "company": "avaron",
        "country": "Sweden",
        "status": "Rejected",
        "last_updated": "2026-02-18 15:31:54",
        "cv_found": true,
        "folder_name": "avaron",
        "country_manual": true
    },
    "12-2-26_Konecranes": {
        "date": "12-2-26",
        "company": "Konecranes",
        "country": "Sweden",
        "status": "Unknown",
        "last_updated": "2026-02-12 15:11:46",
        "cv_found": true,
        "folder_name": "Konecranes"
    },
    "16-2-26_Freenow": {
        "date": "16-2-26",
        "company": "Freenow",
        "country": "Spain",
        "status": "Unknown",
        "last_updated": "2026-02-16 22:00:28",
        "cv_found": true,
        "folder_name": "Freenow"
    },
    "6-2-26_Husqvarna_Group": {
        "date": "6-2-26",
        "company": "Husqvarna Group",
        "country": "Sweden",
        "status": "Unknown",
        "last_updated": "2026-02-06 12:05:51",
        "cv_found": true,
        "folder_name": "Husqvarna_Group"
    },
    "17-2-26_Fever": {
        "date": "17-2-26",
        "company": "Fever",
        "country": "Spain",
        "status": "Unknown",
        "last_updated": "2026-02-17 21:58:08",
        "cv_found": true,
        "folder_name": "Fever"
    },
    "13-2-26_Deutsche_Bank": {
        "date": "13-2-26",
        "company": "Deutsche Bank",
        "country": "Ireland",
        "status": "Unknown",
        "last_updated": "2026-02-13 12:12:56",
        "cv_found": true,
        "folder_name": "Deutsche_Bank"
    },
    "12-2-26_Mailerlite": {
        "date": "12-2-26",
        "company": "Mailerlite",
        "country": "Unknown",
        "status": "Unknown",
        "last_updated": "2026-02-12 15:01:35",
        "cv_found": true,
        "folder_name": "Mailerlite"
    },
    "7-2-26_Cm_Biomass": {
        "date": "7-2-26",
        "company": "Cm Biomass",
        "country": "Denmark",
        "status": "Rejected",
        "last_updated": "2026-02-07 17:16:14",
        "cv_found": true,
        "folder_name": "Cm_Biomass"
    },
    "17-2-26_Bending_Spoons": {
        "date": "17-2-26",
        "company": "Bending Spoons",
        "country": "Spain",
        "status": "Unknown",
        "last_updated": "2026-02-17 16:44:18",
        "cv_found": true,
        "folder_name": "Bending_Spoons"
    },
    "16-2-26_Keystone_Recruitment": {
        "date": "16-2-26",
        "company": "Keystone Recruitment",
        "country": "Unknown",
        "status": "Unknown",
        "last_updated": "2026-02-16 21:30:01",
        "cv_found": true,
        "folder_name": "Keystone_Recruitment"
    },
    "4-2-26_Eigen": {
        "date": "04-02-26",
        "company": "Eigen",
        "folder_name": "Eigen",
        "country": "Norway",
        "status": "In Process",
        "cv_found": true,
        "last_updated": "2026-02-18 15:32:22",
        "country_manual": true
    },
    "22-01-26_Handelsbanken": {
        "date": "22-01-26",
        "company": "Handelsbanken",
        "folder_name": "Handelsbanken",
        "country": "Sweden",
        "status": "In Process",
        "manual": true,
        "last_updated": "2026-02-18 14:17:50"
    },
    "7-2-26_Sievo": {
        "date": "7-2-26",
        "company": "Sievo",
        "country": "Finland",
        "status": "Unknown",
        "last_updated": "2026-02-07 12:13:52",
        "cv_found": true,
        "folder_name": "Sievo"
    },
    "9-2-26_Universum": {
        "date": "9-2-26",
        "company": "Universum",
        "country": "Unknown",
        "status": "Unknown",
        "last_updated": "2026-02-09 09:50:30",
        "cv_found": true,
        "folder_name": "Universum"
    },
    "13-2-26_Coop": {
        "date": "13-2-26",
        "company": "Coop",
        "country": "Unknown",
        "status": "Unknown",
        "last_updated": "2026-02-13 09:03:32",
        "cv_found": true,
        "folder_name": "Coop"
    },
    "13-2-26_Foodora_Ab": {
        "date": "13-2-26",
        "company": "Foodora Ab",
        "country": "Sweden",
        "status": "Unknown",
        "last_updated": "2026-02-13 16:28:05",
        "cv_found": true,
        "folder_name": "Foodora_Ab"
    },
    "9-2-26_Uppsala_University": {
        "date": "9-2-26",
        "company": "Uppsala University",
        "country": "Sweden",
        "status": "Unknown",
        "last_updated": "2026-02-09 11:59:06",
        "cv_found": true,
        "folder_name": "Uppsala_University"
    },
    "14-2-26_Royal_College_Of_Surgeons_In_Ireland": {
        "date": "14-2-26",
        "company": "Royal College Of Surgeons In Ireland",
        "country": "Ireland",
        "status": "Unknown",
        "last_updated": "2026-02-14 15:20:18",
        "cv_found": true,
        "folder_name": "Royal_College_Of_Surgeons_In_Ireland"
    },
    "8-2-26_Sobi": {
        "date": "8-2-26",
        "company": "Sobi",
        "country": "Unknown",
        "status": "Rejected",
        "last_updated": "2026-02-08 18:31:15",
        "cv_found": true,
        "folder_name": "Sobi"
    },
    "18-2-26_Norwegian": {
        "date": "18-2-26",
        "company": "Norwegian",
        "country": "Norway",
        "status": "Unknown",
        "last_updated": "2026-02-18 09:27:50",
        "cv_found": true,
        "folder_name": "Norwegian"
    },
    "11-2-26_Sticky_Solar_Power": {
        "date": "11-2-26",
        "company": "Sticky Solar Power",
        "country": "Sweden",
        "status": "Unknown",
        "last_updated": "2026-02-11 16:46:58",
        "cv_found": true,
        "folder_name": "Sticky_Solar_Power"
    },
    "4-2-26_DreamData": {
        "date": "04-02-26",
        "company": "DreamData",
        "country": "Denmark",
        "status": "Rejected",
        "last_updated": "2026-02-18 15:34:01",
        "cv_found": true,
        "folder_name": "DreamData",
        "country_manual": true
    },
    "10-2-26_Raysearch_Laboratories": {
        "date": "10-2-26",
        "company": "Raysearch Laboratories",
        "country": "Sweden",
        "status": "Unknown",
        "last_updated": "2026-02-10 11:23:28",
        "cv_found": true,
        "folder_name": "Raysearch_Laboratories"
    },
    "17-2-26_Trustpilot": {
        "date": "17-2-26",
        "company": "Trustpilot",
        "country": "Denmark",
        "status": "Unknown",
        "last_updated": "2026-02-17 16:29:47",
        "cv_found": true,
        "folder_name": "Trustpilot"
    },
    "11-2-26_Applegreen": {
        "date": "11-2-26",
        "company": "Applegreen",
        "country": "Unknown",
        "status": "Unknown",
        "last_updated": "2026-02-11 09:57:20",
        "cv_found": true,
        "folder_name": "Applegreen"
    },
    "9-2-26_Esem": {
        "date": "09-02-26",
        "company": "Esem",
        "country": "Sweden",
        "status": "Unknown",
        "last_updated": "2026-02-18 15:34:51",
        "cv_found": true,
        "folder_name": "Esem",
        "country_manual": true
    },
    "13-2-26_Planet_Pharma": {
        "date": "13-2-26",
        "company": "Planet Pharma",
        "country": "Unknown",
        "status": "Unknown",
        "last_updated": "2026-02-13 11:55:43",
        "cv_found": true,
        "folder_name": "Planet_Pharma"
    },
    "11-2-26_Su_Gis": {
        "date": "11-2-26",
        "company": "Su Gis",
        "folder_name": "Su_Gis",
        "country": "Unknown",
        "status": "Unknown",
        "cv_found": true,
        "last_updated": "2026-02-11 09:00:15"
    },
    "16-2-26_BookingCom": {
        "date": "16-2-26",
        "company": "BookingCom",
        "country": "Netherlands",
        "status": "Rejected",
        "last_updated": "2026-02-16 21:41:40",
        "cv_found": true,
        "folder_name": "BookingCom"
    },
    "12-2-26_Kustom": {
        "date": "12-2-26",
        "company": "Kustom",
        "country": "Unknown",
        "status": "Unknown",
        "last_updated": "2026-02-12 09:58:51",
        "cv_found": true,
        "folder_name": "Kustom"
    },
    "13-2-26_Aktia_Bank_Plc": {
        "date": "13-2-26",
        "company": "Aktia Bank Plc",
        "country": "Finland",
        "status": "Unknown",
        "last_updated": "2026-02-13 12:33:42",
        "cv_found": true,
        "folder_name": "Aktia_Bank_Plc"
    },
    "15-2-26_Karolinska_Institute": {
        "date": "15-2-26",
        "company": "Karolinska Institute",
        "country": "Sweden",
        "status": "Unknown",
        "last_updated": "2026-02-15 16:21:16",
        "cv_found": true,
        "folder_name": "Karolinska_Institute"
    },
    "16-2-26_Enode": {
        "date": "16-2-26",
        "company": "Enode",
        "country": "Norway",
        "status": "Unknown",
        "last_updated": "2026-02-16 11:01:53",
        "cv_found": true,
        "folder_name": "Enode"
    },
    "18-2-26_Tasman_Analytics": {
        "date": "18-2-26",
        "company": "Tasman Analytics",
        "country": "Netherlands",
        "status": "Rejected",
        "cv_found": true,
        "last_updated": "2026-02-18 10:24:03",
        "folder_name": "Tasman_Analytics"
    },
    "10-2-26_Dnv": {
        "date": "10-2-26",
        "company": "Dnv",
        "country": "Unknown",
        "status": "Unknown",
        "last_updated": "2026-02-10 19:27:46",
        "cv_found": true,
        "folder_name": "Dnv"
    },
    "15-2-26_Costa_Coffee": {
        "date": "15-2-26",
        "company": "Costa Coffee",
        "country": "UK",
        "status": "Rejected",
        "last_updated": "2026-02-15 11:06:38",
        "cv_found": true,
        "folder_name": "Costa_Coffee"
    },
    "5-2-26_WeTravel": {
        "date": "5-2-26",
        "company": "WeTravel",
        "folder_name": "WeTravel",
        "country": "Unknown",
        "status": "Unknown",
        "cv_found": true,
        "last_updated": "2026-02-05 11:22:27"
    },
    "9-2-26_Geoguessr": {
        "date": "09-02-26",
        "company": "Geoguessr",
        "country": "Sweden",
        "status": "Rejected",
        "last_updated": "2026-02-18 15:31:44",
        "cv_found": true,
        "folder_name": "Geoguessr",
        "country_manual": true
    },
    "5-2-26_Salling_Group": {
        "date": "05-02-26",
        "company": "Salling Group",
        "country": "Denmark",
        "status": "Rejected",
        "last_updated": "2026-02-18 15:31:59",
        "cv_found": true,
        "folder_name": "Salling_Group",
        "country_manual": true
    },
    "7-2-26_Novo_Nordisk": {
        "date": "7-2-26",
        "company": "Novo Nordisk",
        "country": "Denmark",
        "status": "Unknown",
        "last_updated": "2026-02-07 12:33:46",
        "cv_found": true,
        "folder_name": "Novo_Nordisk"
    },
    "11-2-26_Better_Collective": {
        "date": "11-2-26",
        "company": "Better Collective",
        "country": "Unknown",
        "status": "Unknown",
        "last_updated": "2026-02-11 16:04:49",
        "cv_found": true,
        "folder_name": "Better_Collective"
    },
    "11-2-26_Senovo_It": {
        "date": "11-2-26",
        "company": "Senovo It",
        "country": "Unknown",
        "status": "Unknown",
        "last_updated": "2026-02-11 15:57:17",
        "cv_found": true,
        "folder_name": "Senovo_It"
    },
    "5-2-26_Proofpoint": {
        "date": "05-02-26",
        "company": "Proofpoint",
        "country": "Ireland",
        "status": "Rejected",
        "last_updated": "2026-02-18 15:33:00",
        "cv_found": true,
        "folder_name": "Proofpoint",
        "country_manual": true
    },
    "18-2-26_Ceartas": {
        "date": "18-2-26",
        "company": "Ceartas",
        "country": "Germany",
        "status": "Unknown",
        "cv_found": true,
        "last_updated": "2026-02-18 13:49:28",
        "folder_name": "Ceartas"
    },
    "18-2-26_EpiqEnergy": {
        "date": "18-2-26",
        "company": "EpiqEnergy",
        "country": "Denmark",
        "status": "Unknown",
        "cv_found": true,
        "last_updated": "2026-02-18 10:09:10",
        "folder_name": "EpiqEnergy"
    },
    "13-2-26_Nordplay_Group": {
        "date": "13-2-26",
        "company": "Nordplay Group",
        "country": "Sweden",
        "status": "Rejected",
        "last_updated": "2026-02-13 12:04:39",
        "cv_found": true,
        "folder_name": "Nordplay_Group"
    },
    "7-2-26_Digifarm": {
        "date": "7-2-26",
        "company": "Digifarm",
        "country": "Norway",
        "status": "Unknown",
        "last_updated": "2026-02-07 10:31:23",
        "cv_found": true,
        "folder_name": "Digifarm"
    },
    "11-2-26_Kongsberg_Maritime": {
        "date": "11-2-26",
        "company": "Kongsberg Maritime",
        "folder_name": "Kongsberg_Maritime",
        "country": "Unknown",
        "status": "Unknown",
        "cv_found": true,
        "last_updated": "2026-02-11 09:43:18"
    },
    "18-2-26_Nordea": {
        "date": "18-2-26",
        "company": "Nordea",
        "folder_name": "Nordea",
        "country": "Finland",
        "status": "Unknown",
        "cv_found": true,
        "last_updated": "2026-02-18 15:03:17"
    },
    "16-2-26_Danish_Refugee_Council": {
        "date": "16-2-26",
        "company": "Danish Refugee Council",
        "country": "Denmark",
        "status": "Unknown",
        "last_updated": "2026-02-16 17:06:37",
        "cv_found": true,
        "folder_name": "Danish_Refugee_Council"
    },
    "10-2-26_Mindway_Ai": {
        "date": "10-02-26",
        "company": "Mindway Ai",
        "country": "Denmark",
        "status": "Rejected",
        "last_updated": "2026-02-18 15:31:30",
        "cv_found": true,
        "folder_name": "Mindway_Ai",
        "country_manual": true
    },
    "5-2-26_reach_subsea": {
        "date": "5-2-26",
        "company": "reach subsea",
        "country": "Unknown",
        "status": "Unknown",
        "last_updated": "2026-02-05 14:57:42",
        "cv_found": true,
        "folder_name": "reach_subsea"
    },
    "6-2-26_incluso_PBI": {
        "date": "06-02-26",
        "company": "incluso PBI",
        "country": "Sweden",
        "status": "Unknown",
        "last_updated": "2026-02-18 15:33:31",
        "cv_found": true,
        "folder_name": "incluso_PBI",
        "country_manual": true
    },
    "3-2-26_StormGeo": {
        "date": "3-2-26",
        "company": "StormGeo",
        "country": "Unknown",
        "status": "Followed Up",
        "last_updated": "2026-02-03 20:34:41",
        "cv_found": true,
        "folder_name": "StormGeo"
    },
    "5-2-26_wpp": {
        "date": "05-02-26",
        "company": "wpp",
        "country": "Ireland",
        "status": "Unknown",
        "last_updated": "2026-02-18 15:33:06",
        "cv_found": true,
        "folder_name": "wpp",
        "country_manual": true
    },
    "10-2-26_Academic_Work": {
        "date": "10-02-26",
        "company": "Academic Work",
        "country": "Sweden",
        "status": "Rejected",
        "last_updated": "2026-02-18 15:31:36",
        "cv_found": true,
        "folder_name": "Academic_Work",
        "country_manual": true
    },
    "10-2-26_Solvex_Solutions": {
        "date": "10-2-26",
        "company": "Solvex Solutions",
        "country": "Unknown",
        "status": "Unknown",
        "last_updated": "2026-02-10 10:18:32",
        "cv_found": true,
        "folder_name": "Solvex_Solutions"
    },
    "4-2-26_Nordregio": {
        "date": "4-2-26",
        "company": "Nordregio",
        "country": "Unknown",
        "status": "Followed Up",
        "last_updated": "2026-02-04 13:45:53",
        "cv_found": true,
        "folder_name": "Nordregio"
    },
    "27-01-26_Maynooth_University": {
        "date": "27-01-26",
        "company": "Maynooth University",
        "folder_name": "Maynooth_University",
        "country": "Ireland",
        "status": "In Process",
        "manual": true,
        "last_updated": "2026-02-18 14:15:41"
    },
    "6-2-26_connexus": {
        "date": "06-02-26",
        "company": "connexus",
        "country": "Denmark",
        "status": "Rejected",
        "last_updated": "2026-02-18 15:33:36",
        "cv_found": true,
        "folder_name": "connexus",
        "country_manual": true
    },
    "13-2-26_Sensor_F\u00f6rs\u00e4kring_Norden_Ab": {
        "date": "13-2-26",
        "company": "Sensor F\u00f6rs\u00e4kring Norden Ab",
        "country": "Sweden",
        "status": "Unknown",
        "last_updated": "2026-02-13 15:38:51",
        "cv_found": true,
        "folder_name": "Sensor_F\u00f6rs\u00e4kring_Norden_Ab"
    },
    "5-2-26_abacus": {
        "date": "5-2-26",
        "company": "abacus",
        "country": "Unknown",
        "status": "Rejected",
        "last_updated": "2026-02-05 15:42:02",
        "cv_found": true,
        "folder_name": "abacus"
    },
    "4-2-26_UHG": {
        "date": "04-02-26",
        "company": "UHG",
        "country": "Ireland",
        "status": "Rejected",
        "last_updated": "2026-02-18 15:33:52",
        "cv_found": true,
        "folder_name": "UHG",
        "country_manual": true
    },
    "12-2-26_Antire": {
        "date": "12-2-26",
        "company": "Antire",
        "country": "Unknown",
        "status": "Unknown",
        "last_updated": "2026-02-12 14:55:00",
        "cv_found": true,
        "folder_name": "Antire"
    },
    "6-2-26_smadex": {
        "date": "6-2-26",
        "company": "smadex",
        "country": "Unknown",
        "status": "Rejected",
        "last_updated": "2026-02-06 11:13:19",
        "cv_found": true,
        "folder_name": "smadex"
    },
    "4-2-26_Magasin_du_Nord": {
        "date": "04-02-26",
        "company": "Magasin du Nord",
        "folder_name": "Magasin_du_Nord",
        "country": "Denmark",
        "status": "Unknown",
        "cv_found": true,
        "last_updated": "2026-02-18 15:34:30",
        "country_manual": true
    },
    "6-2-26_volvo": {
        "date": "6-2-26",
        "company": "volvo",
        "country": "Sweden",
        "status": "Unknown",
        "last_updated": "2026-02-06 09:20:35",
        "cv_found": true,
        "folder_name": "volvo"
    },
    "5-2-26_Xebia": {
        "date": "05-02-26",
        "company": "Xebia",
        "folder_name": "Xebia",
        "country": "Netherlands",
        "status": "Unknown",
        "cv_found": true,
        "last_updated": "2026-02-18 15:32:04",
        "country_manual": true
    },
    "5-2-26_tataa": {
        "date": "5-2-26",
        "company": "tataa",
        "country": "Sweden",
        "status": "Unknown",
        "last_updated": "2026-02-05 09:49:09",
        "cv_found": true,
        "folder_name": "tataa"
    },
    "7-2-26_Qliro": {
        "date": "7-2-26",
        "company": "Qliro",
        "country": "Sweden",
        "status": "Unknown",
        "last_updated": "2026-02-07 09:59:09",
        "cv_found": true,
        "folder_name": "Qliro"
    },
    "6-2-26_elvium": {
        "date": "6-2-26",
        "company": "elvium",
        "country": "Unknown",
        "status": "Unknown",
        "last_updated": "2026-02-06 12:42:27",
        "cv_found": true,
        "folder_name": "elvium"
    },
    "4-2-26_Sams\u00f8e_Sams\u00f8e": {
        "date": "04-02-26",
        "company": "Sams\u00f8e Sams\u00f8e",
        "country": "Denmark",
        "status": "Followed Up",
        "last_updated": "2026-02-18 15:32:36",
        "cv_found": true,
        "folder_name": "Sams\u00f8e_Sams\u00f8e",
        "country_manual": true
    },
    "9-2-26_Flatpay": {
        "date": "9-2-26",
        "company": "Flatpay",
        "country": "Unknown",
        "status": "Unknown",
        "last_updated": "2026-02-09 18:11:33",
        "cv_found": true,
        "folder_name": "Flatpay"
    },
    "15-2-26_Bavarian_Nordic": {
        "date": "15-2-26",
        "company": "Bavarian Nordic",
        "folder_name": "Bavarian_Nordic",
        "country": "Denmark",
        "status": "Unknown",
        "cv_found": true,
        "last_updated": "2026-02-18 15:22:49",
        "country_manual": true
    },
    "4-2-26_Supercell": {
        "date": "04-02-26",
        "company": "Supercell",
        "country": "Sweden",
        "status": "Rejected",
        "last_updated": "2026-02-18 15:33:58",
        "cv_found": true,
        "folder_name": "Supercell",
        "country_manual": true
    },
    "16-2-26_Nexer_Tech_Talent": {
        "date": "16-2-26",
        "company": "Nexer Tech Talent",
        "country": "Netherlands",
        "status": "Unknown",
        "last_updated": "2026-02-16 21:47:45",
        "cv_found": true,
        "folder_name": "Nexer_Tech_Talent"
    },
    "16-2-26_Wpp_Media": {
        "date": "16-2-26",
        "company": "Wpp Media",
        "country": "Denmark",
        "status": "Unknown",
        "last_updated": "2026-02-16 17:29:31",
        "cv_found": true,
        "folder_name": "Wpp_Media"
    },
    "5-2-26_orange": {
        "date": "5-2-26",
        "company": "orange",
        "country": "Sweden",
        "status": "Unknown",
        "last_updated": "2026-02-05 09:13:05",
        "cv_found": true,
        "folder_name": "orange"
    },
    "6-2-26_eiti": {
        "date": "6-2-26",
        "company": "eiti",
        "country": "Unknown",
        "status": "Unknown",
        "last_updated": "2026-02-06 09:41:42",
        "cv_found": true,
        "folder_name": "eiti"
    },
    "10-2-26_Spotify": {
        "date": "10-02-26",
        "company": "Spotify",
        "country": "Sweden",
        "status": "Unknown",
        "last_updated": "2026-02-18 15:31:17",
        "cv_found": true,
        "folder_name": "Spotify",
        "country_manual": true
    },
    "16-2-26_Powermatch": {
        "date": "16-2-26",
        "company": "Powermatch",
        "country": "Denmark",
        "status": "Unknown",
        "last_updated": "2026-02-16 09:56:43",
        "cv_found": true,
        "folder_name": "Powermatch"
    },
    "17-2-26_Opus": {
        "date": "17-2-26",
        "company": "Opus",
        "country": "Spain",
        "status": "Unknown",
        "last_updated": "2026-02-17 14:08:27",
        "cv_found": true,
        "folder_name": "Opus"
    },
    "18-2-26_Tus": {
        "date": "18-2-26",
        "company": "Tus",
        "country": "Ireland",
        "status": "Unknown",
        "cv_found": true,
        "last_updated": "2026-02-18 11:41:53",
        "folder_name": "Tus"
    },
    "13-2-26_Swedbank": {
        "date": "13-2-26",
        "company": "Swedbank",
        "country": "Sweden",
        "status": "Unknown",
        "last_updated": "2026-02-13 10:05:03",
        "cv_found": true,
        "folder_name": "Swedbank"
    },
    "13-2-26_Wiklunds": {
        "date": "13-2-26",
        "company": "Wiklunds",
        "country": "Sweden",
        "status": "Unknown",
        "last_updated": "2026-02-13 10:41:14",
        "cv_found": true,
        "folder_name": "Wiklunds"
    },
    "10-2-26_Frostlogic": {
        "date": "10-2-26",
        "company": "Frostlogic",
        "folder_name": "Frostlogic",
        "country": "Unknown",
        "status": "Unknown",
        "cv_found": true,
        "last_updated": "2026-02-10 19:51:50"
    },
    "17-2-26_Haybury": {
        "date": "17-2-26",
        "company": "Haybury",
        "country": "Spain",
        "status": "Unknown",
        "last_updated": "2026-02-17 22:16:00",
        "cv_found": true,
        "folder_name": "Haybury"
    },
    "12-2-26_Dustin": {
        "date": "12-2-26",
        "company": "Dustin",
        "country": "Unknown",
        "status": "Unknown",
        "last_updated": "2026-02-12 10:27:52",
        "cv_found": true,
        "folder_name": "Dustin"
    },
    "5-2-26_Kognity": {
        "date": "05-02-26",
        "company": "Kognity",
        "folder_name": "Kognity",
        "country": "Sweden",
        "status": "Unknown",
        "cv_found": true,
        "last_updated": "2026-02-18 15:32:09",
        "country_manual": true
    },
    "6-2-26_magnit": {
        "date": "06-02-26",
        "company": "magnit",
        "country": "Sweden",
        "status": "Unknown",
        "last_updated": "2026-02-18 15:34:38",
        "cv_found": true,
        "folder_name": "magnit",
        "country_manual": true
    },
    "17-2-26_Uwe": {
        "date": "17-2-26",
        "company": "Uwe",
        "country": "UK",
        "status": "Unknown",
        "last_updated": "2026-02-17 21:01:20",
        "cv_found": true,
        "folder_name": "Uwe"
    },
    "6-2-26_incluso": {
        "date": "06-02-26",
        "company": "incluso",
        "country": "Sweden",
        "status": "Rejected",
        "last_updated": "2026-02-18 15:33:21",
        "cv_found": true,
        "folder_name": "incluso",
        "country_manual": true
    },
    "11-02-26_ICIMS": {
        "date": "03-02-26",
        "company": "ICIMS",
        "folder_name": "ICIMS",
        "country": "Ireland",
        "status": "In Process",
        "manual": true,
        "last_updated": "2026-02-18 14:52:28"
    },
    "16-2-26_Netcompany": {
        "date": "16-2-26",
        "company": "Netcompany",
        "country": "Denmark",
        "status": "Unknown",
        "last_updated": "2026-02-16 21:24:07",
        "cv_found": true,
        "folder_name": "Netcompany"
    },
    "13-2-26_Deploja": {
        "date": "13-2-26",
        "company": "Deploja",
        "folder_name": "Deploja",
        "country": "Unknown",
        "status": "Unknown",
        "cv_found": true,
        "last_updated": "2026-02-13 09:47:28"
    },
    "18-02-26_Test_Company": {
        "date": "18-02-26",
        "company": "Test Company",
        "folder_name": "Test_Company",
        "country": "Denmark",
        "country_manual": true,
        "status": "Unknown",
        "manual": true,
        "last_updated": "2026-02-18 15:14:21"
    },
    "16-2-26_Agni": {
        "date": "16-2-26",
        "company": "Agni",
        "country": "Unknown",
        "status": "Unknown",
        "last_updated": "2026-02-16 21:02:48",
        "cv_found": true,
        "folder_name": "Agni"
    },
    "7-2-26_Nato": {
        "date": "7-2-26",
        "company": "Nato",
        "country": "Netherlands",
        "status": "Unknown",
        "last_updated": "2026-02-07 11:16:56",
        "cv_found": true,
        "folder_name": "Nato"
    },
    "12-2-26_Postnord": {
        "date": "12-02-26",
        "company": "Postnord",
        "folder_name": "Postnord",
        "country": "Sweden",
        "status": "Unknown",
        "cv_found": true,
        "last_updated": "2026-02-18 15:28:19",
        "country_manual": true
    },
    "10-2-26_Mitigram": {
        "date": "10-2-26",
        "company": "Mitigram",
        "country": "Sweden",
        "status": "Unknown",
        "last_updated": "2026-02-10 09:58:31",
        "cv_found": true,
        "folder_name": "Mitigram"
    },
    "5-2-26_Nokia": {
        "date": "05-02-26",
        "company": "Nokia",
        "country": "Finland",
        "status": "Rejected",
        "last_updated": "2026-02-18 15:32:55",
        "cv_found": true,
        "folder_name": "Nokia",
        "country_manual": true
    },
    "18-2-26_Uber": {
        "date": "18-2-26",
        "company": "Uber",
        "country": "Netherlands",
        "status": "Unknown",
        "cv_found": true,
        "last_updated": "2026-02-18 13:40:19",
        "folder_name": "Uber"
    },
    "10-2-26_Northmill": {
        "date": "10-2-26",
        "company": "Northmill",
        "country": "Unknown",
        "status": "Unknown",
        "last_updated": "2026-02-10 19:38:41",
        "cv_found": true,
        "folder_name": "Northmill"
    },
    "17-2-26_Exclusive_Networks": {
        "date": "17-2-26",
        "company": "Exclusive Networks",
        "country": "Spain",
        "status": "Unknown",
        "last_updated": "2026-02-17 14:24:31",
        "cv_found": true,
        "folder_name": "Exclusive_Networks"
    },
    "11-2-26_Vellox": {
        "date": "11-2-26",
        "company": "Vellox",
        "country": "Unknown",
        "status": "Unknown",
        "last_updated": "2026-02-11 09:27:08",
        "cv_found": true,
        "folder_name": "Vellox"
    },
    "10-2-26_Deploja": {
        "date": "10-02-26",
        "company": "Deploja",
        "country": "Sweden",
        "status": "Unknown",
        "last_updated": "2026-02-18 15:34:46",
        "cv_found": true,
        "folder_name": "Deploja",
        "country_manual": true
    },
    "4-2-26_UppsalaUniversity": {
        "date": "4-2-26",
        "company": "UppsalaUniversity",
        "country": "Sweden",
        "status": "Followed Up",
        "last_updated": "2026-02-04 11:57:22",
        "cv_found": true,
        "folder_name": "UppsalaUniversity"
    },
    "18-2-26_Migx_Ag": {
        "date": "18-2-26",
        "company": "Migx Ag",
        "folder_name": "Migx_Ag",
        "country": "Spain",
        "status": "Unknown",
        "last_updated": "2026-02-18 14:07:41",
        "cv_found": true
    },
    "17-2-26_Magma_Math": {
        "date": "17-2-26",
        "company": "Magma Math",
        "country": "Sweden",
        "status": "Unknown",
        "last_updated": "2026-02-17 13:36:34",
        "cv_found": true,
        "folder_name": "Magma_Math"
    }
}